{
  "manifest_status": "contract-only",
  "query_count": 36,
  "minimum_query_count": 300,
  "query_type_counts": {
    "semantic": 11,
    "exact_identifier": 5,
    "typo": 5,
    "morphology": 5,
    "long_context": 5,
    "negative": 5
  },
  "missing_query_types": [
    "semantic",
    "exact_identifier",
    "typo",
    "morphology",
    "long_context",
    "negative"
  ],
  "split_counts": {
    "development": 20,
    "test": 7,
    "validation": 9
  },
  "split_ratios": {
    "development": 0.555556,
    "test": 0.194444,
    "validation": 0.25
  },
  "recommended_split": {
    "development": 0.6,
    "validation": 0.2,
    "test": 0.2
  },
  "missing_splits": [],
  "split_ratio_issues": [],
  "size_bucket_counts": {
    "small": 30,
    "medium": 6,
    "large": 0
  },
  "corpus_size_bucket_counts": {
    "small": 13,
    "medium": 1,
    "large": 0
  },
  "corpus_parser_versions": [
    "csv-v1",
    "email-v1",
    "html-v3",
    "json-v1",
    "jsonl-v1",
    "plain-text-v1",
    "rtf-v1",
    "xml-v1",
    "yaml-v1"
  ],
  "fixture_parser_versions": [
    "csv-v1",
    "email-v1",
    "html-v3",
    "json-v1",
    "jsonl-v1",
    "plain-text-v1",
    "rtf-v1",
    "xml-v1",
    "yaml-v1"
  ],
  "parser_versions_binding_status": "valid",
  "corpus_checksum": "sha256:80170ea3cd3b1adb2b4ecc71918a9460a87050a6cfbcf22fa639611e8dded919",
  "fixture_corpus_checksum": "sha256:80170ea3cd3b1adb2b4ecc71918a9460a87050a6cfbcf22fa639611e8dded919",
  "fixture_checksum": "sha256:082d140bab147fbd69a562adb3fdeeaab8fdfc29ed6bee737bc9a2c52b9f5968",
  "chunk_size_bucket_binding_status": "valid",
  "queries_with_size_bucket_mismatch": 0,
  "unknown_size_bucket_chunk_count": 0,
  "missing_document_size_buckets": [
    "large"
  ],
  "filter_selectivity_counts": {
    "low": 15,
    "medium": 13,
    "high": 8
  },
  "missing_filter_selectivity_buckets": [],
  "coverage_complete": false,
  "corpus_binding_status": "valid",
  "corpus_checksum_status": "valid",
  "unknown_relevant_chunk_count": 0,
  "queries_with_unknown_relevant_chunks": 0,
  "duplicate_query_group_count": 0,
  "duplicate_query_count": 0,
  "cross_split_duplicate_count": 0,
  "labels_status": "review-required",
  "label_provenance_status": "valid",
  "label_provenance_mismatch_count": 0,
  "label_count": 36,
  "unlabeled_query_count": 0,
  "orphan_label_count": 0,
  "derived_label_count": 36,
  "review_required_label_count": 36,
  "unknown_labeled_chunk_count": 0,
  "labels_with_unknown_chunks": 0
}
